{
  "version_contrato": 2,
  "evento_id": "12121212-1212-4121-8121-121212121212",
  "sucursal": {
    "id": "11111111-1111-4111-8111-111111111111",
    "clave": "LAB01"
  },
  "cliente_id": "13131313-1313-4131-8131-131313131313",
  "version_origen": 4,
  "operacion": "upsert",
  "ocurrido_en": "2026-09-24T10:08:00-06:00",
  "cliente": {
    "clave_corta": "100123",
    "nombre": "Cliente sintético",
    "notas": "Datos exclusivamente de prueba.",
    "comentarios_multiples": false,
    "activo": true,
    "creado_en": "2026-09-20T09:00:00-06:00",
    "actualizado_en": "2026-09-24T10:08:00-06:00",
    "telefonos": [
      {
        "id": "14141414-1414-4141-8141-141414141414",
        "numero": "5550000000",
        "etiqueta": "Principal",
        "principal": true,
        "activo": true,
        "creado_en": "2026-09-20T09:00:00-06:00"
      }
    ],
    "domicilios": [
      {
        "id": "15151515-1515-4151-8151-151515151515",
        "etiqueta": "Laboratorio",
        "calle": "Calle de prueba",
        "numero_exterior": "1",
        "numero_interior": "",
        "colonia": "Colonia sintética",
        "codigo_postal": "00000",
        "municipio": "Municipio de prueba",
        "referencia": "Sin datos reales",
        "principal": true,
        "activo": true,
        "creado_en": "2026-09-20T09:00:00-06:00"
      }
    ]
  },
  "contenido_sha256": "0323323255427121da28cb03317ba48ed1b490a2d9cc49e59598a4bb1e53b3a6"
}
